{
  "artifact_id": "urn:synapse:artifact:authorization-record:v1",
  "artifact_type": "synapse.authorization-record.v1",
  "content_hash": "sha256:aaaaaaaaaaaaaaaaaaaaaaaaaaaaaaaaaaaaaaaaaaaaaaaaaaaaaaaaaaaaaaaa",
  "input_references": [],
  "lifecycle_state": "active",
  "logical_id": "authorization-record",
  "output_references": [],
  "producer": {
    "kind": "process",
    "producer_id": "synapse.contract-fixture"
  },
  "provenance": {
    "activity": {
      "activity_id": "synapse.fixture.authorization-record",
      "activity_version": "1"
    },
    "parameters": {},
    "reproduction": [
      "Load the scoped authorization-record declaration.",
      "Verify the immutable authorization-record content hash."
    ],
    "source_references": [
      "repository:joselunasrt8-creator/SYNAPSE@issue-160"
    ]
  },
  "relationships": [],
  "schema_version": "synapse.artifact-registry-object.v1",
  "validity": {
    "assessed_by": null,
    "basis": null,
    "state": "unassessed"
  },
  "version": 1
}
