{
  "artifact_id": "urn:synapse:artifact:repository-snapshot:v1",
  "artifact_type": "synapse.repository-snapshot.v1",
  "content_hash": "sha256:0000000000000000000000000000000000000000000000000000000000000001",
  "input_references": [],
  "lifecycle_state": "active",
  "logical_id": "repository-snapshot",
  "output_references": [
    "urn:synapse:artifact:observation:v1"
  ],
  "producer": {
    "kind": "process",
    "producer_id": "synapse.contract-fixture"
  },
  "provenance": {
    "activity": {
      "activity_id": "synapse.fixture.snapshot",
      "activity_version": "1"
    },
    "parameters": {},
    "reproduction": [
      "Load the declared inputs for snapshot.",
      "Apply synapse.fixture.snapshot version 1 and verify the content hash."
    ],
    "source_references": [
      "repository:joselunasrt8-creator/SYNAPSE@issue-160"
    ]
  },
  "relationships": [],
  "schema_version": "synapse.artifact-registry-object.v1",
  "validity": {
    "assessed_by": null,
    "basis": null,
    "state": "unassessed"
  },
  "version": 1
}
